{"event_id":"event-task-created-001","event_type":"task.created","schema_version":"1.0.0","occurred_at":"2026-08-19T09:07:00Z","correlation_id":"corr-ahd-demo-0001","idempotency_key":"idem-task-created-001","identity":{"tenant_id":"tenant-ahd","project_id":"project-ahd-demo","run_id":"run-ahd-demo-0001","step_id":"1","revision":1},"integration_mode":"simulated","simulation_id":"sim-local-ahd-001","payload":{"task_id":"task-ahd-demo-001","task_type":"missing_input","blocking":true}}
