{"event_id":"event-step-blocked-001","event_type":"step.blocked","schema_version":"1.0.0","occurred_at":"2026-08-19T09:02:00Z","correlation_id":"corr-ahd-demo-0001","idempotency_key":"idem-step-blocked-001","identity":{"tenant_id":"tenant-ahd","project_id":"project-ahd-demo","run_id":"run-ahd-demo-0001","step_id":"1","revision":1},"integration_mode":"simulated","simulation_id":"sim-local-ahd-001","payload":{"blocker_id":"blocker-input-001","blocker_type":"input","reason":"Customer access is missing."}}
