{"event_id":"event-artifact-created-001","event_type":"artifact.created","schema_version":"1.0.0","occurred_at":"2026-08-19T09:03:00Z","correlation_id":"corr-ahd-demo-0001","idempotency_key":"idem-artifact-created-001","identity":{"tenant_id":"tenant-ahd","project_id":"project-ahd-demo","run_id":"run-ahd-demo-0001","step_id":"1","revision":1,"artifact_id":"artifact-ahd-demo-001"},"integration_mode":"simulated","simulation_id":"sim-local-ahd-001","payload":{"artifact":{"artifact_id":"artifact-ahd-demo-001","revision":1,"content_sha256":"bbbbbbbbbbbbbbbbbbbbbbbbbbbbbbbbbbbbbbbbbbbbbbbbbbbbbbbbbbbbbbbb"}}}
