{"event_id":"event-project-created-001","event_type":"project.created","schema_version":"1.0.0","occurred_at":"2026-08-19T09:00:00Z","correlation_id":"corr-ahd-demo-0001","idempotency_key":"idem-project-created-001","identity":{"tenant_id":"tenant-ahd","project_id":"project-ahd-demo"},"integration_mode":"simulated","simulation_id":"sim-local-ahd-001","payload":{"project_name":"AHD Hausbesuch","owner_id":"owner-raphael"}}
