{"event_id":"event-run-resumed-001","event_type":"run.resumed","schema_version":"1.0.0","occurred_at":"2026-08-19T09:11:00Z","correlation_id":"corr-ahd-demo-0001","idempotency_key":"idem-run-resumed-001","identity":{"tenant_id":"tenant-ahd","project_id":"project-ahd-demo","run_id":"run-ahd-demo-0001","step_id":"1","revision":1},"integration_mode":"simulated","simulation_id":"sim-local-ahd-001","payload":{"resume_command_id":"command-resume-ahd-0001"}}
