{"event_id":"event-gate-ready-001","event_type":"gate.ready","schema_version":"1.0.0","occurred_at":"2026-08-19T09:04:00Z","correlation_id":"corr-ahd-demo-0001","idempotency_key":"idem-gate-ready-001","identity":{"tenant_id":"tenant-ahd","project_id":"project-ahd-demo","run_id":"run-ahd-demo-0001","step_id":"1","revision":1,"artifact_id":"artifact-ahd-demo-001"},"integration_mode":"simulated","simulation_id":"sim-local-ahd-001","payload":{"gate_id":"GATE-1","artifact_sha256":"bbbbbbbbbbbbbbbbbbbbbbbbbbbbbbbbbbbbbbbbbbbbbbbbbbbbbbbbbbbbbbbb"}}
