{"event_id":"event-release-created-001","event_type":"release.created","schema_version":"1.0.0","occurred_at":"2026-08-19T09:12:00Z","correlation_id":"corr-ahd-demo-0001","idempotency_key":"idem-release-created-001","identity":{"tenant_id":"tenant-ahd","project_id":"project-ahd-demo","run_id":"run-ahd-demo-0001","step_id":"1","revision":1,"artifact_id":"artifact-ahd-demo-001"},"integration_mode":"simulated","simulation_id":"sim-local-ahd-001","payload":{"release_id":"release-ahd-0001","gate_id":"GATE-1","artifact_sha256":"bbbbbbbbbbbbbbbbbbbbbbbbbbbbbbbbbbbbbbbbbbbbbbbbbbbbbbbbbbbbbbbb"}}
